{
    "blockchainName": "bsc",
    "chainId": 56,
    "contracts": [
        {
            "address": "0x9a065e500cdcd01c0a506b0eb1a8b060b0ce1379",
            "contractName": "NestedFactory",
            "selectors": {
                "0x51227094": {
                    "erc20OfInterest": [
                        "_batchedOrders.0.outputToken",
                        "_batchedOrders.0.orders.-1.token"
                    ],
                    "method": "processOutputOrders",
                    "plugin": "Nested"
                },
                "0x90e1aa69": {
                    "erc20OfInterest": [
                        "_batchedOrders.0.inputToken",
                        "_batchedOrders.0.orders.-1.token"
                    ],
                    "method": "processInputOrders",
                    "plugin": "Nested"
                },
                "0xa378534b": {
                    "erc20OfInterest": [
                        "_batchedOrders.0.inputToken",
                        "_batchedOrders.0.orders.-1.token"
                    ],
                    "method": "create",
                    "plugin": "Nested"
                },
                "0xbba9b10c": {
                    "erc20OfInterest": [
                        "_buyToken",
                        "_orders.0.token"
                    ],
                    "method": "destroy",
                    "plugin": "Nested"
                }
            }
        },
        {
            "address": "0x449d088c9f184af598fe72d26742a58a11c5200f",
            "contractName": "FeeSplitter",
            "selectors": {
                "0x6d9634b7": {
                    "erc20OfInterest": [
                        "_tokens.0",
                        "_tokens.-1"
                    ],
                    "method": "releaseTokens",
                    "plugin": "Nested"
                }
            }
        },
        {
            "address": "0x0fff7f99d2b32849848e31cb48090c5268e06f65",
            "contractName": "NestedNFT",
            "selectors": {
                "0x23b872dd": {
                    "erc20OfInterest": [],
                    "method": "transferFrom",
                    "plugin": "Nested"
                }
            }
        }
    ],
    "name": "Nested"
}